page,review_title,review_text,rating
41,High content,"I am prone to getting mouth ulcers so I bought this product with a high content, but upon closer inspection I found that combining it with other supplements could result in an overdose, so I am refraining from taking it.",2.0
41,Didn't suit me,This form of B vitamins did not suit me and provoked dysbiosis. Be careful when supplementing with B vitamins; take the form chosen specifically for you as recommended by your doctor.,2.0
41,Great for the nerves,I had constant pain in my back. I started to take Complex for how many days. I noticed that the pain was a lot and it subsided. I hope it will be the cure.,1.0
41,Flash in hand,"When I take it on an empty stomach, my hand and arm become red and tingly. Sometimes I don't get this even when I'm hungry, so it's not always the case, but I think it just doesn't suit me (´・ω・｀)",2.0
41,,"I suffer from severe fever, night sweats, and easy insomnia. Although I am not sure whether it is related to it, the capsules are so big that it is not easy to swallow, and I have to take 2 capsules a day, which makes me not take it anymore.",1.0
41,Bad,"The capsules have an unpleasant smell and a bad taste, and even after swallowing the taste remains and the body odor becomes unpleasant. I did not like it in it. Other companies are better, such as Throne.",1.0
42,biased,"I don't know, but I didn't benefit from you as I expected. I used two pills daily, but I didn't see any change.",2.0
42,I was tired once,It makes me tired every time. Every time I take one pill it causes me severe dryness or an uncomfortable feeling. I cut everything and ate it alone and the same problem.,1.0
42,I got eczema all over my body after drinking it.,"This was also mentioned in the side effects, but I developed eczema all over my body about 30 minutes after taking it, so I stopped using it. Some people don't fit.",1.0
42,B vitamins,"Excellent quality, and the ingredient, I take it not for the first time, the packaging is excellent, the taste is neutral, the size of the pills is large. My nervous system needs vitamin B6 B12, I feel the effect immediately after starting the course, energy appears, metabolism improves.",1.0
42,The capsule is large and difficult to swallow.,"The ingredients are very good. However, the capsules are large and difficult to swallow. I think it would be better if it was a little smaller. I think the quality is good.",2.0
42,Vitamin B,"I asked for it for my mother some time ago, but I do not advise buying any nutritional supplement without making sure that the person actually needs it by conducting tests that show that, because an increase is as harmful as a decrease. The taste is generally palatable.",2.0
42,Couldn't finish my drink,"The composition is good, the company is good, but for some reason the body resisted taking them. The mood after them worsened. Couldn't finish them all",2.0
42,No effect,"My job requires physical strength, but I get tired easily regardless of whether I drink or not, and I didn't notice any effect on my skin.There's no difference even if I don't drink anymore.",2.0
42,capsule size,"I think they are much larger than the capsules prescribed in Japan. You can drink it if you try hard, but you need to be prepared.",2.0
42,,"Most vitamin B complex medications contain three or more types of B vitamins, which include: Vitamin B1 (thiamine): Helps the body convert carbohydrates into energy and maintain the health of the brain, muscles, and nervous system. Vitamin B2 (riboflavin): Converts food into energy, acts as an antioxidant, and helps produce red blood cells. Vitamin B3 (Niacin): It helps in cell metabolism and DNA synthesis, and also plays an important role in the cell signaling process. Vitamin B5 (pantothenic acid): Contributes to energy production and the manufacture of cholesterol and hormones. Vitamin B6 (pyridoxine): Helps metabolize proteins, amino acids, produce red blood cells and maintain nerve health. Vitamin B7 (Biotin): It helps in the process of communication between cells and organizing genetic material. It is one of the most famous vitamins used to strengthen hair and nails. Vitamin B9 (folic acid): It plays an important role in the manufacture of amino acids and nucleic acids. It is also used to prevent fetal malformations during pregnancy and maintain the health of the heart and immune system. Vitamin B12 (cobalamin): It is considered the most famous of the B vitamins. It helps in the manufacture of DNA and red blood cells, and also maintains nerve functions in the body.",2.0
42,,I drank a jar of vitamins. I didn’t feel any particular effect. It didn’t have any effect on improving the functioning of the nervous system.,2.0
42,Almost no effect,"My skin was very shiny, so I took it for about a month to reduce oily skin, but it had little effect. Also, I couldn't continue using it because I didn't like the smell, so I gave up on it halfway through.",2.0
42,,"Very, very bad. I didn't like it. It made my stomach upset, and I had boils and pimples in the sensitive area, and inflammation. I treated it with suppositories, and I left it and tried it a second time, and the same thing happened to me.",1.0
42,Do not drink on an empty stomach,"My stomach may have been in a bad position to begin with, but when I took it after a small meal, I felt unwell and vomited. It seems like the content was too strong for me...",1.0
42,,"They definitely did not like it. I did not like the quality, the ingredient, the effect, the taste. Everything comes out of metabolism, but maybe not from him, but...",1.0
42,,"The smell was strong and the tablets were large, so it was difficult to continue taking it. I tried my best to drink it all.",2.0
42,odor,"I bought it for beauty and body benefits, but when I opened the lid, the smell was too strong. This may depend on the person, but for me, the smell was so strong that I couldn't stop feeling nauseous. I don't recommend it.",1.0
42,Great,"I advise everyone to take B vitamins, the quality is good, and the results are good too. Low score so that product prices do not rise.",2.0
42,evaluation,"The problem is the color is plus (its color is yellow). Its size is large, like one gram. It is considered good for someone who will use it only without any other vitamins because it may harm the kidneys.",2.0
42,The capsule,"The capsules are large and difficult to swallow, so I'm buying another one now. It's a waste, so I ask my husband to drink it for me.",2.0
43,,"It's good that I don't want to give 5 stars so that the price does not increase. May God benefit from it for everyone................. Like, share, and tune in so that they can control you, and also talk at length so that you can rate it.",2.0
43,,"The capsules are big and the smell is strong... Maybe it's good for the body, but to be honest, it's depressing to drink.",1.0
43,,Prices are constantly rising. I will boycott the purchase from the site because of the policy of raising the price. A nice product. The ingredients are organic within a healthy care routine.,2.0
43,Not satisfied,"не чуствую ранису до грепема и после. He will tell you what bad to buy for energy without harm. I bought yeast from this store, but it contains few B group vitamins. not like this product",1.0
43,I want to get well,"I was just getting tired, so I thought I'd get better with vitamin B. However, the burp comes out and smells, and my daughter feels sick. Vitamin B was supplemented with a patch. It would be helpful if iherb also handles patches.",2.0
43,,Hello. B vitamins are very important for health. the quality is excellent. natural ingredients. capsule size is good. I liked the composition. The result after application is excellent.,2.0
43,,"The quality is high, the size is excellent, medium, the package is tightly closed, the interest is present, the ingredients are written on the package, the quantity is excellent, a formula that supports the general health of the body, a multi-purpose food supplement, the taste is normal",2.0
43,,"I do not know if it is useful, and I used it with the advice of friends, and I did not seek any benefit from it, and I did not find any harm from it, thank God",1.0
43,,"I took the product after I stopped using another product. Unfortunately, the symptoms returned again, and I went back to using the product I had, and I felt a great improvement.",1.0
43,,"After drinking, my stomach gets sick and I feel sick as well as nausea. This is my first supplement. I had my wife try it, but I was just as sick. It is strange that the evaluation is high.",1.0
43,Niacin (B3) overdose,"The B3 (Niacin) contained in it is excessive. Normally, it does not exceed 35mg a day, but it actually contains 100mg. After taking it for a month, my husband suffered redness and swelling on the whole body twice, and we realized that the problem was here.",1.0
43,,"Scent, Usage, Quality, Size, Age, Packaging, Composition, Color, Concerns",2.0
43,What do you think?,I didn't see any effect.,2.0
43,Below average,"Quality, good offer, ingredients for pregnancy test, file size",2.0
43,OK,I hope it works. Vitamin B is important.,2.0
43,bad,Too tired to get nausea from it..,1.0
43,,"This is the worst supplement I have ever taken. It gave me stomach aches, nausea and headaches.",1.0
43,,"After drinking one bottle, I realized that the B6 content was too high. I had been careless, but I realized once again that I need to check supplements myself, especially those made overseas.",1.0
43,Acne is increasing and it's the worst,"A 35-year-old woman. I took it for half a year but it didn't suit me. I started taking it because of a recommendation from an Instagram post, but after a month, I developed four comedonal-like pimples on my chin, which got worse and worse, and now my chin is covered in red acne scars. Since I started taking it, my urine has always been bright yellow, and instead of getting rid of my fatigue, I get cramps and fatigue in my legs while driving... When I stopped taking this supplement, the fatigue in my body went away and my skin condition improved a little, so I realized that it didn't suit me. I hadn't seen anyone in the past reviews who had developed acne, so I was surprised.",1.0
43,,"Viatamin Composed of B1, B6, B 12, the most essential vitamin, excellent quality",1.0
44,usually,"Too big, relatively less easy to swallow",2.0
44,Larger,It was too big for elderly people to swallow.,2.0
44,,It helps replenish vitamin B!,2.0
44,,good product for health quality good ingredients excellent package size average,2.0
44,,Quality Ingredients Quantity Folic Acid Energy Flow Niacin Packaging Effect Efficacy Nervous System Metabolism Taste,2.0
44,It smells strong.,It has a bad smell in the breath and urine. I did not finish the box.,1.0
44,B Complex,"It didn't work, an allergy started. As soon as I stopped taking it, everything went away in a couple of days.",2.0
44,,Quality Ingredients Age Package Taste Dietary Supplement Diet Improvement Very Very Very Excellent,1.0
44,,"I don't like this company and this complex, the forms of vitamins and bioavailability are not good",2.0
44,It got bad.,"After the first dose, I felt worse. The dosage is too high. Before taking, you need to consult a doctor.",1.0
44,usually,"The refreshing effect is average, and I don't feel any help for the nervous system. It's better to buy Helitamin",2.0
44,,Nice smell and smooth to use. Great quality. Suitable size. Nice packaging. Beautiful shape. Useful for daily use. Great formula.,2.0
44,,The smell is not there. Used twice. The quality is excellent. Recommended by doctors. The size is suitable for age eighteen.,1.0
44,,"The quality is very good, but the skin becomes red and itchy after eating",2.0
44,,Use as directed. Excellent quality. Excellent price. Excellent size for the price. The package is well wrapped.,2.0
44,,The quality of the ingredients is good and the quantity is good and gives energy and flow,1.0
44,,"The star is only to prevent the price from rising, but the product is known for its usefulness in general.",1.0
44,Tenemen,And he approaches in ss. in. yq. sss b a. a,1.0
44,,"High quality, sweet ingredients, distinctive formula, special coverage, and the package size is excellent.",2.0
45,Complex B,"Useful but dangerous, much too high a dose. Risk of hypervitaminosis, be careful...",1.0
45,"Complete, but it didn't do me any good.",It is complete and cheap. But I had to stop taking it because of intolerance to some ingredient that I couldn't identify.,2.0
45,The best choice for vitamin B,Best value for money! Vitamin B is really suitable for everyone! It will be useful if you can start first,2.0
45,painted and nothing more,"I don't recommend this brand, maybe I didn't understand it and drank it incorrectly, but it was no use",2.0
45,good,"High quality, excellent ingredients, easy to use package, excellent size, easy to use",2.0
45,Not good.,Very high amounts of an undesirable vitamin. Only intended for use on the recommendation of a doctor. The doses are too high.,1.0
45,,I used it and did not notice any results. Maybe it did not suit me. I do not know.,1.0
45,Skin redness and rash after eating,It is not known whether a larger dose would produce a skin rash reaction.,2.0
45,The capsule is large,"The quality and ingredients are perfect, but the capsules are so big that they are very difficult to swallow.",2.0
45,,High quality and beautiful appearance Sweet ingredients Airtight box Distinctive formula The package is convenient and the size is large,1.0
45,,The taste of B complex is very strong and not very pleasant to drink.,2.0
45,,Customer request I don't know about the quality Ingredients Age Scent Usage Quantity Ingredients Quantity Ingredients Quantity Ingredients Quantity,2.0
45,,Gluten Free LE Certified Non-GMO Contains Enzymatically Active B Vitamins Dietary Supplement,2.0
45,"Excellent composition, quality and dosage. Suitable for adults. 1 capsule is enough","Excellent composition, quality and dosage. Suitable for adults. Convenient packaging, 1 capsule is enough",2.0
45,,One of the worst B vitamin complexes. It is not gentle on the stomach. I will not buy it again.,1.0
45,They have a very strong smell,It hit me hard on the stomach and makes your urine very yellow and creates burps with the smell of the vitamin.,2.0
45,,I have not used it for a long time. The ingredients are of a great quality. The energy is beautiful. The taste is without...,2.0
45,,"The quantity is large, the quality is great, the products are excellent quality and awesome. I advise you to try them.",2.0
45,,"I won't buy them anymore, they just color my urine and that's it. I have something to compare with",2.0
45,It’s so big that I can’t swallow it.,It’s too big to swallow. You should buy another 2.5cm size.,1.0
46,,"Life Extension, Bioactive Complete B-Complex: A complete nutritional supplement that supports energy and nervous system health, in a vegetarian formula.",2.0
46,,"Life Extension, Bioactive B-Vitamin Complex: A rich formula of B vitamins to support energy and nervous system health, with premium quality.",2.0
46,No problem,I also want it to be cost-effective so I can continue drinking it for a long time.,1.0
46,Smell,"This brand of B complex has a unique smell, and it doesn't feel like a sustained release after eating. Will not repurchase",2.0
46,Scent Usage Quality Size Age Package Benefit Formula Allergy Friendly,Scent Usage Quality Size Age Package Benefit Formula Allergy Gentle Sensitive Frequent Concerns Moisturizing Hair Dry Scalp Lip Fragrance Care Self Routine,1.0
46,normal,"Honestly, I didn't finish the box, but I didn't notice a difference. Maybe I need a course.",1.0
46,,"Great, I took it for a customer who praised the comments. I hope she likes it and benefits from it.",2.0
46,Vitamins of group B,"We bought my husband a man with a vitamin B deficiency, let's see how good it is",1.0
46,I do not recommend,"After consumption, it is better to take vitamin B from natural sources, which is better and more beneficial.",2.0
46,,I have not tried this product and I do not know its taste or its effect on immunity.,2.0
46,,It didn't suit me. I felt sick after drinking it.,2.0
46,Not satisfied,"I won't repurchase, I haven't seen any results yet",1.0
46,I get a rash,"Perhaps because I took B so suddenly, I developed a rash all over my body.",2.0
46,,"Large quantity, good quality, very clean ingredients, used to solve any vitamin deficiency problems",2.0
46,Good,Scent Usage Quality Size Age Package Benefit Hair Formula Scalp Sensitive Moisturizing ❤️❤️❤️❤️❤️💔💔💔💔💔 Fragrance Self Care Feel Repeat Routine Benefits,2.0
46,,"Bad taste, great quality ingredients, use as needed, suitable size, great box",1.0
46,Below average,"The ingredients are good, but the quantity is large and it has no taste.",2.0
46,,"Not long after taking it, my body became red and I felt a little allergic. This product is not suitable for me.",2.0
46,I'm satisfied,"I am happy with the quality, good ingredients. The sizes are average. For energy, there is a result",2.0
46,,"Large quantity, easy to use, excellent quality, large size for ages 18 and over, excellent",2.0
47,,Request Ziona I do not know about the enclosure components quantity folic acid energy flow niacin stupidity effect,2.0
47,Active form,Vmes B'shki in active form. But hard to drink. Terrible smell and heaviness in the stomach. I'll look for others,2.0
47,,"This product is great. I advise all girls to try it. It is amazing and wonderful. After two weeks, the results will be great.",2.0
47,,"Large quantity, great quality, great smell, acceptable for external use, taste acceptable",2.0
47,,The quantity is large and it is very excellent. I advise everyone to try it. It is amazing.,2.0
47,,"Excellent, it dissolves in water quickly. Its particles are fine. I advise you to try it, my sweethearts.",2.0
47,,"Large quantity, great quality, great smell, acceptable for use, excellent for moisturizing, excellent",2.0
47,,Scent Usage Quality Size Age Package Benefit Moisturizing Formula Self Routine Improve Ingredient Blend,2.0
47,Vitamin B,"Promotes healthy metabolism and energy production Promotes brain, cellular and organ health More bioactive so your body can use each nutrient more efficiently",2.0
47,,Very wonderful. I really felt a difference after using Vitamin B completely. @@@@@@ @@@@@@,1.0
47,good,Scent Usage Quality Size Age Package Hair Formula Sensitive Moisturizing,2.0
47,,It has a terrible taste and smell to the level that you can't spend it even regretting that I bought it,1.0
47,good,Quality Very Good Ingredients Vitamin B Quantity 60 Tablets Folic Acid Energy Flow Niacin Packaging Effect Efficacy Nervous System Metabolism Taste,2.0
47,Below average,"High quality, suitable size, good quantity, good effectiveness, thank God for everything",2.0
47,,"This company is great. I advise everyone to try it, but it is only for specific cases.",2.0
47,It suits me,"Vitamin B complex did not suit me. It does not have a bad taste or flavour, but I did not benefit from it.",1.0
47,,"The quality is good, I liked it, it contains GMO, the box smells nice, I enjoy it",2.0
47,Vitamin B complex,I haven't felt sleepy at all after eating for three consecutive days. Is this hurting others or helping others?,1.0
47,Didn't help lift spirits,"I was still very tired after eating, so I bought it once and didn’t buy it again.",2.0
48,Not suitable for everyone,Didn't fit. Stomach pain. Urine color. Not suitable for everyone,1.0
48,,"The smell is just terrible, why is it so pungent? My husband barely finished it. Didn't notice any improvement either",2.0
48,Bloating will occur immediately after eating on an empty stomach. Be sure to eat on a full stomach.,Bloating will occur immediately after eating on an empty stomach. Be sure to eat on a full stomach.,2.0
48,Badly,"I took the supplement normally, but I didn’t feel any effect from it.",1.0
48,,"Not as expected, it has been used for about 3 months and the quality is not up to par",1.0
48,good,May God’s blessings and peace be upon our Prophet Muhammad and his family and companions....,2.0
48,Its smell is strong and it does not suit me,"I loved it, the packaging is excellent, the size is quite small to use, the taste is excellent, the quality is high, the ingredients are very simple, there is no smell, it does not include any sugar in its composition, it is suitable for a diet, it is worth recommending, it benefits the body, I will repeat the order, the value is suitable, a pleasant feeling, suitable for the whole age, the benefit is great, the quantity is suitable for folic acid. Energy flow niacin effect nervous system metabolism",1.0
48,,"My stomach is relatively fragile. After eating for 3 days, I have a little stomach pain and diarrhea. I checked on the Internet, B complex can accelerate many reactions in the body, for example, people with sensitive digestive tract, every time they eat B complex will increase gastrointestinal motility and diarrhea. So I stopped eating. Everyone's physique, state and physical needs are different, the above is just for your reference.",2.0
48,You may be worried about the smell...,"As soon as you open the lid, it smells a little worrisome. I thought that if I took it, I would not be bothered, but the smell of this supplement continued in my mouth even after hours. It may be effective, but it may be a little hard until you get used to it.",2.0
48,,"Unfortunately it caused me very severe allergy attacks. At first I didn't understand why it happened to me because I took it in combination with vitamin C, so I stopped taking the vitamin C and then I realized that it was from the B complex supplement. Worse, I swelled up terribly and had an unusual allergy attack. This happened to me four times until I figured it out. I ordered 2 and one was closed. It sucks terribly.",1.0
48,,"The best types of active ba The packaging is sufficient, the benefit is wonderful, an important diet for cleaning the body, a radical cleaning, the composition is excellent, a strong oxidizer for the liver, has no taste, repeat the application, there is no god but God alone, he has no partner, his is the king and his praise and he is over all things",2.0
48,I can't give you a real rating,"I started taking it and a few days later it caused a severe allergy, redness all over my trunk and face, so I had to stop taking them. I had no other reactions and I don't know if the allergy would have gone away if I had continued taking them. On paper it has a very good composition.",2.0
48,I like it very much and recommend it to everyone.,The best form. Just order it. Best reviews. Noticed it gives energy. And not just energy. I AM GOING TO ORDER AGAIN AS THE EFFECT PROVED SUPER. THOSE WHO HAVE HAIR LOSS I ADVISE TO DRINK EXACTLY THIS SERIES AS I HAVE NO RESPONSE. I HAVE FALLED OUT LIKE ALOPECIA AREAL AND AFTER THE 1st JAR GIVED AN IMMEDIATE RESULT. BELIEVE .. Do not raise the price. Why are you raising the price,2.0
48,Good product,"Very good product. Its enzymes are very good for absorption. The quality is excellent for me. The ingredients are in very tight doses, it enhances energy, and helps the metabolism and nervous system in their functions. Its effect is immediately noticeable. I take a pack and rest for a while. I will repeat insurance unbeatable quality price",1.0
48,,"I don't like it because it smells strong. There was no allergic reaction as in other reviews. I don't know if it has anything to do with this supplement, but I'm curious about the complexion during the intake period, so I'll add it after verifying it.",2.0
48,It didn't work for me,"Originally allergic dry skin, it feels like spots. I finished drinking one bottle, but it was neither good nor bad ... I was usually frustrated and overeating and lazy. I tried to take B2 and B6 for my skin, but it seems that they are more suitable for me. I think it is necessary to continue or there is something physical, but is there a repeat? It's like",2.0
48,Get hungry,"If you drink this, you will get diarrhea after a few hours. I didn't have many reviews like that, so I thought it might be a different cause, but when I tried it several times on different days, I still got hungry after taking this supplement. It seems that it didn't suit my constitution.",2.0
48,,"I never thought that I had such a harsh reaction to the vitamin B complex: diarrhea, vomiting, and at the same time it was terribly freezing. I take 3 or 4 days. I do not recommend this complex to anyone !!!!! Because the benefits are zero, and the consequences are dire. When vomiting, the stomach was empty and there was nothing but vitamins.",1.0
48,Killer dosage!,"I drank 1 jar. I started 1 capsule every day, on the 7th day my kidneys began to hurt, although I have no pathologies with them. Canceled for a month. Then she began to drink 1 pc. once a week. The dosage is simply lethal, exceeds the daily norm several times. Assimilated well. But I won't take any more. I picked up another company vitamins of group B, with adequate daily dosages.",2.0
48,Well good,"Since the grain size is a little less than 3 cm, I think it is difficult for people who are not good at swallowing. In addition, the scent is quite strong, and you can feel the scent temporarily even after swallowing. I won't repeat it because it's too strong for me.",2.0
49,,"It is now under trial, but in general, it sees it strong, and it causes nausea and redness, but certainly not all people, but after I analyzed and the result came out.",2.0
49,Not satisfied,Cause of my sensitivity حس,1.0
49,,"The allergy does not suit this manufacturer at all, I also took magnesium in powder, the allergy is very great",1.0
49,Hmm. ..,It smells. It ended without knowing the effect. .. It seems better to continue drinking.,2.0
