page,review_title,review_text,rating
32,It didn't suit me...,"I got a headache and felt sick. I think it depends on the person whether it suits them or not. This is just my personal opinion, but I think it's a good supplement for those who like it!",2.0
32,bad,It causes severe stomach pain. The pills are very big. I think you should buy the vitamin you need. They are not all in one pill.,1.0
32,,"Great, amazing vitamin B. It is very good for bones, joints, and bone cracking. I benefited from it. It deserves five stars, but I will give it two stars so that its price does not increase.",2.0
32,Strange yellow pills,"The tablets taste normal, I wouldn't say that they speed up metabolism, they don't help the nervous system, there's no increase in energy either, the size is too big,",2.0
32,,Quality is wow Ingredients are wow Quantity is wow Skin is wow Hair is wow Package is great Benefit is still nails is wow Improvement is still collagen No dermatitis No taste is perfect Easy to use Age is perfect Flavor is coconut,2.0
32,complex,"The quality is not very good, there are better ones. It comes in capsules, if the child cannot swallow, you can easily open the capsule, the taste is ok",2.0
32,,The smell is nice to use. It seems easy to use. The quality and size are excellent. The packaging is suitable. The benefit of its composition is that I have not tried it yet.,1.0
33,Below average,"What I liked is that it makes the urine dark yellow. I didn’t finish the rest. It might be excellent, but I didn’t like it.",2.0
33,,"Cool vitamin, I have been ordering for the third year already. Very useful. Packaged perfectly. I also like the taste. The quality is good. I recommend buying. If the review was useful, please give me a like.",2.0
33,reaction,It only took three pills to realize that it wasn't the right supplement. The urine comes out too yellow no matter how much water I drink.,1.0
33,,I put a star so that the price does not go up. The best thing for vitamin B complex is to take it in the morning on an empty stomach.,1.0
33,,"The quality is excellent, the ingredients are beautiful, the quantity is appropriate, a lot of immunity, the hair is wonderful, the packaging is not healthy, I think",1.0
33,Great,"Prescribed by a nutritionist after passing all the tests, I have hypothyroidism and problems with the thyroid gland. I drink 2 capsules in the morning on an empty stomach, the course is 2 months. What I began to notice is that in the morning",2.0
33,,"The quality is great, the ingredients are excellent, the quantity is sufficient, the metals are beautiful, the plastic is great, and the benefit is great.",1.0
33,I didn't continue with it,"A good product, its ingredients are as written, its effectiveness is good, and its delivery is good. However, I noticed that the large number of supplements, while their effectiveness is below the required level, puts pressure on the body.",2.0
33,"Flat, but not for me","Taking another brand of B complex, saw this cheaper, serve average, have a nauseous feeling, entered 3 bottles, let my husband eat, he did not have any adverse reactions, maybe their own psychological effects",2.0
33,,"The particles are a bit big and I feel like vomiting every time I swallow them. I don’t know why, but occasionally I actually vomit it out.",1.0
33,Generous size!,"The ingredients are natural and healthy, so you can use it with confidence. It doesn't have any particular taste, so I think it's easy to take as a supplement.",2.0
33,I didn't really feel it.,"Although the pills are large, you can drink it by pouring it down. I think the ingredients are good. There is nothing particularly dirty about it. If you want to take in vitamin B complex, give it a try.",2.0
33,not a hit,Stains the urine with a phosphorescent color. The capsules are large with a really harsh smell. I couldn't bear these two so I stopped taking them.,2.0
33,,"The day I took it, I felt dizzy and nauseous, so I didn’t finish it. I always feel that this company doesn’t suit me.",2.0
33,,The smell is nice to use. It seems easy to use. The quality and size are excellent. The packaging is suitable. The benefit of its composition. I have not tried it yet.,2.0
33,Irritation to the vagina,The product caused a burning sensation in my urethra. terrible. And my urine was bright yellow for two days. Both for me and my husband.,1.0
33,,"O God, I hope for Your mercy, so do not leave me to myself for the blink of an eye, and fix all my affairs, there is no god but You",1.0
33,,"It's too big, so it's hard to swallow. It gets stuck in your throat. It dissolves in your throat, and you burp... You'll be surprised when you burp out bright yellow urine in the toilet.",2.0
33,The smell is terrible,The smell is strong. The smell of the toilet after drinking is also strong. I learned from everyone's reviews that there is an upper limit to the intake of B vitamins for Japanese people.,2.0
33,Not satisfied,"I don't know why, but after drinking one capsule for two days, my body became tired, achy and exhausted. Maybe the doses are high.",1.0
34,Comprehensive Group B,"The refreshing effect is not good and I think it is of no use. If you want to relieve fatigue, you can think about it again.",2.0
34,,It has no taste and causes urine to turn a deep yellow color. It improves the nervous system. It is a large quantity and effective in stimulating the body and providing energy. It is of medium quality.,2.0
34,,"I bought it because it had good reviews, but to be honest I didn't understand it at all. I bought it once and will not buy it again.",2.0
34,Its concentration is very high.,The concentration is very high and the body does not need it. It is noticed in the urine and I do not think the body benefits from it.,2.0
34,,"In a capsule - vitamins filled with powder - this is not possible, because they are antagonists (inactivate each other). Layer-by-layer application of vitamins is required. That is why the urine is colored in a bright color - they are excreted unabsorbed. Placebo effect! Everything will turn out in ugitaz.",1.0
34,,"I didn't like the taste. . The vitamin B is carefully selected, so I think it's a good product once you get used to the taste. I take it together with vitamin C. I'm feeling good!",2.0
34,,"I didn't like it that much. I didn't feel any improvement, maybe you should take different vitamins and not a complex. I won't buy again.",2.0
34,Extra large capsule size,"I think the ingredients are good, but the capsules are very large and difficult to swallow, probably because they are made overseas. I would like the size to be a little smaller, even if it means increasing the number of capsules per dose.",2.0
34,,"The quantity is sufficient, the quality is great, the smell is beautiful, the experience is excellent. I advise everyone to try it, it is enough for a while",2.0
34,,"Its ingredients are clean and the size of the package is suitable for the price. Its source is vegetarian and it is light on the stomach, but it is necessary to consult a doctor before trying to drink a lot of water.",2.0
34,super,"The supplement is great. Its action is very well-organized. My regular purchase. I will recommend it to my friends. I give one star, as it was noticed that products with a high rating become more expensive. Please like me 👍",1.0
34,"I didn't feel the effects I expected, and the cost performance was not so good.","I bought this product because it was very popular, but to be honest, I didn't feel much effect. I was hoping that it would help prevent mouth ulcers, but in my case, I didn't see any improvement. There were many reviews about niacin flush, so I avoided taking it on an empty stomach (as a result, I didn't experience any niacin flush symptoms). Furthermore, I didn't feel that it was particularly good value for money compared to other B complex supplements. Despite the price being a little high, I didn't see any visible effect, so I didn't see any value in continuing. It was a little disappointing because I had high expectations because it was so popular. Of course, it depends on the individual, but for me, other options may be better.",1.0
34,B vitamins are an essential and important component of the daily diet.,"〰️Here are some functions of B vitamins: normalize the work of the nervous and cardiovascular systems; improve bowel function, skin condition; support emotional health, help to cope with stress, depression, increased emotional stress; participate in cell growth, in energy exchange, in muscle work; strengthen the immune system and increase the body's resistance to various diseases. 📍Each vitamin has not only its number, but also its name, as well as its purpose. Signs ⬇️⬇️⬇️ Since most of the B vitamins affect the functioning of the nervous system and brain, one of the first signs of a lack of this group will be increased fatigue, irritability, insomnia, depression, memory and attention impairment, weakness. If, in addition, your hair is actively falling out and your nails are breaking, then this may be another sign of a lack of vitamins. packaged in good quality. the size of the pills is average ✅️ If it was useful for you, like it 👍 ☘️",1.0
34,,"Very high dosages. The first week everything was fine, but the second week I was allergic to it. Stopped drinking",2.0
34,Very high dosage,"I don't know how I overlooked that there are such horse dosages in capsules, it is idle. Once I decided to drink half a capsule, glad of the experiment, I was terribly twisting my muscles all day. It is better to take a One-Per-Day or Two-Per-Day complex from the same company, these are complex multivitamins with an adequate dosage.",2.0
34,The pill is large,The pill is large and difficult to swallow. The quality of this brand is good.,1.0
34,The size is...,"I'm not sure about the effects, but the capsule size is just too big, so I was a little hesitant to take it...",2.0
34,Good,As long as I take this vitamin I rarely get sick...could it be from this vitamin?,1.0
34,B complex,A good B-complex from Life. Gives strength and energy. A quality product. And the medium sizes are easy to drink.,2.0
34,Below average,"ate, but do not know what has changed, the portion is large",2.0
35,,Easy to use. Excellent quality. Medium size. Pleasant scent. Excellent package size.,1.0
35,,Check out Nada Harfoush's review of B-Wash supplements and the best source for them; you'll find it helpful.,1.0
35,,"I noticed results within a couple of weeks: I had more energy, my mood and concentration improved.",2.0
35,,"Quality, ingredients, age, packaging, taste, dietary supplement, diet improvement, excellent, very, very, very, very, very, very, very",1.0
35,B complex,Vitamin B complex. Excellent in spring and fall. Provides energy and is beneficial for the nervous system. Contains folic acid and niacin.,2.0
35,,"Scent, Use, Quality, Size, Age, Packaging, Benefits, Composition, Color, Texture",2.0
35,allergic reaction,"Unfortunately, I only used it twice and each time I had an allergic reaction to it (shortness of breath and a strong cough).",2.0
35,,Please research and consult your doctor regarding the appropriate dosage of Vitamin B6; high concentrations can have adverse effects.,1.0
35,Very high dosage!,Very high dosage! Take only after testing and only on the recommendation of a doctor.,2.0
35,,"High quality, beautiful appearance, unique formula, special coverage, tightly sealed packaging. I love it and will buy it again.",2.0
35,,"Quality, ingredients, age, packaging, taste, dietary supplement, diet improvement, excellent, very, very, very, very, very, very, very, very, very, very",1.0
35,Didn't like it,"The quality is not very good, the capsules are large, have an unpleasant specific smell. I do not recommend it.",2.0
35,What I liked,"It smells bad and hurts the stomach. The best thing is what the Ministry of Health dispenses, especially for people with sensitive stomachs.",2.0
35,,"Scent, Use, Quality, Size, Age, Package, Benefits, Moisturizing Formula, Self-Routine, Improved Ingredient Blend",2.0
35,,"Synthetic vehicles prevented me from sleeping at night. I stopped taking them last year. They are effective, but they didn't suit me.",2.0
35,,"A customer ordered: I don't know about the quality, ingredients, quantity, chickpeas, folic acid, energy, flow, niacin, packaging, effect, efficacy. Nervous system.",2.0
35,Useless,"Useless supplement if you eat a minimum balanced diet, I don't even know why I bought it anymore.",1.0
35,,"Honestly, I've only used it for two days, so I can't advise you on whether to buy it or not.",2.0
35,"Not bad, next time I can do it for several days.","Not bad, next time I can do it for several days.",1.0
36,Vitamin B,I haven't used the vitamin yet; I'll use it after a while and give my review.,1.0
36,Complete Vitamin B Complex,"Benefits of a complete, bioactive B complex vitamin: Boosts energy production and promotes healthy metabolism. Promotes brain, cell, and organ health. More bioactive so your body can utilize each nutrient more effectively.",1.0
36,I have hives,"I received it today and took it immediately, and about 30 minutes later, the back of my hand started tingling, my whole arm turned red, and I developed hives. I bought it without checking the negative reviews, but it seems that many people develop hives. I'm really scared, so I'm going to stop taking it.",1.0
36,,I tried to start taking it. Every time on the second day after taking it I felt bad. My head was spinning and my heart rate was racing. The doctor recommended stopping taking this supplement. The result of the reception is negative. Perhaps this complex is not suitable for me. High quality packaging. The size is convenient for taking. The taste is ordinary. The ingredients are good.,2.0
36,,"A good amount, the size is easy to swallow, the problem is that it caused me hot flashes, which I would take in the morning and itching in my body, I would take it on an empty stomach, and that I started to change and eat before the situation improved",2.0
36,It's quite big.,"The capsule is 2.6cm long and 8mm in diameter. It is about twice as large as the standard capsules sold in Japan. I am grateful that I can take in vitamin B complex, but to be honest, this size is hard to swallow. It also tastes like medicine, and to be honest, after taking one tablet, I don't want to reach for it again...",2.0
36,Vitamin B,"Its smell and taste are initially unpalatable. You have to drink something immediately after it, but I noticed that the urine was very yellow. I used a pill. I don’t know what is normal. Although I asked a specialist, she said it is normal, but not to the extent of this effect of the pill. I was not convinced.",1.0
36,terrible,"This company produces good drugs, I took it for my daughter, who has a severe deficiency of vitamin B, we will take tests again then I will add to the review. During the intake, my whole body began to itch, although I am not allergic at all. After stopping the intake, the itching disappeared in a day. I cannot recommend this product, unfortunately. If you liked the review, put a like 🙂",1.0
36,,"This product is of good quality and I always order it because B12 is in the form of methylcobalamin, which is the best for metabolism, and not cyanocobalamin. It has a mild taste, but it is acceptable and very beneficial for the nervous system, especially for the elderly. It is very important for those who suffer from anemia because B12 helps... Maintaining the blood so that it does not drop and its level decreases.. The quantity is sufficient for a month if you take two pills every day, or for two months if you get sufficient vitamin B from food, I strongly recommend purchasing it.",2.0
36,I don't know,"I'm tired, but I don't know if it is from it or from the new vitamins I tried. It gave me dizziness, my blood pressure dropped, and extreme fatigue. Try it alone without anything to know if it suits you, and be careful to eat it while you do not have a vitamin B deficiency.",2.0
36,size too big,"I'm the type of person who doesn't mind swallowing 4 or 5 Japanese-sized tablets at once. This is the first time I've taken a foreign supplement, and although it's not too big, it's hard to swallow because it's so big that I hesitate for a while before taking it. There are no repeats. (Because the size is too big for me) For those who are worried about the size.",2.0
36,stomachache,"I don't have a body that often suffers from stomachaches, but every time I take this B complex after a meal, I feel nauseous and want to vomit. It feels too irritating to the stomach. It should be effective, but it has been discontinued because of adverse reactions to the stomach.",2.0
36,,"Looking at the ingredients listed, the quality is high. However, when I squeeze it, it turns bright yellow, so maybe... is it all flowing? I bought two and drank them all, but when I was drinking them, the only thing that had changed since I quit was the color of the small ones. lol",2.0
36,Below average,"I didn't even finish it, I was sure about these vitamins, but unfortunately for some reason they didn't work for me. I felt bad, I had a headache, I didn't have any more energy, my nervous system didn't stabilize, but on the contrary I was irritated, I didn't notice any good effects at all, so I stopped drinking First you need to consult a doctor, and then order pills. I don’t understand why this happened to me, but I had a negative reaction to these pills, maybe the quality is not very good",2.0
36,Vitamin D,"Vitamin D is considered beneficial for the nervous system, metabolism, bones, teeth, etc. The ingredients are good, but the quality and effectiveness are difficult to guarantee, since, unfortunately, I did not see the desired result on myself. The mood and energy level were at the bottom and remained)) The size is standard for this type of vitamin. The packaging opens faster and easier than screw caps.",2.0
36,,"The first one is B, so I bought it and tried it. After checking the results, I tried one pill a day. The taste was okay, the pills were relatively large, and the worst was a slight allergy. After reading the reviews, I realized that many people had allergic reactions! If you want to know the doctor’s opinion, try it first",2.0
36,Not everyone eats it,"The ""Niacin"" in this product may cause redness, itching, or tingling on the face, arms, and chest for some people. At first I thought I was allergic to something, but it wasn’t until I developed an allergy one night after taking it independently that I discovered it was related to this product. I strongly recommend testing it at a low dose.",2.0
36,Vitamin B complex,"The ingredients include vitamin B, and the amount of capsules is good. I used them previously, and the effectiveness of the effect was good for my condition on the nervous system and metabolism. The flow of niacin did not harm me, and the energy was acceptable, and also because it contains folic acid. The package contains a reasonable number of capsules, but I buy two boxes, usually the quality is usually good.",2.0
36,no,"Honestly, I don't recommend it at all. I don't know if I got tired of it. To be honest, I haven't used it. Every time I use it, I get palpitations, so I throw it away and use it again. I can go back and order the liquid type. They praise it a lot. As for the slurry, I don't recommend it, I swear, only the connection and packaging are excellent.",1.0
36,,I have supported it many times and have eaten it for several years. I have bought at least a dozen cans in total. The fishy smell I received this time is too heavy. Just holding the capsule with my hands will leave an overweight fishy smell. It was not there before. Please don’t claim to have a five-star inspection. regardless of quality,2.0
37,,"I bought it because it had good reviews. I usually drink Thorn Research's B Complex. My impressions after drinking this B were that the experience was not very good. Personally, I didn't feel like it was working much for my stiff shoulders. It seems like Thorne is the right fit for me.",2.0
37,,"I could not drink these vitamins. I took one capsule at a time and after three days problems started, pains in the stomach, kidneys, etc. Maybe this is a coincidence with some other factors, but I don't use them anymore. It seems to me that the complex is too aggressive, too many components.",2.0
37,,"It's been 4-5 days since I started drinking, but the smell is unbearable just by opening the lid. It's a capsule, but I've never had any other capsule type that felt so hard to swallow. Even after drinking, the smell returns for a few minutes. The price was reasonable, but I'm not confident that I can continue, so I will rate it here.",2.0
37,odor,"Every time I get a canker sore or my eyes get tired, I search for it and it says it's good for vitamin B, so I take it, but as soon as I put it in my mouth, I regret the smell. It doesn't go away for a while, but I get a sore in my mouth so I start drinking again, and my eyes get tired so I start drinking again. As soon as it gets better, stop drinking and repeat. It's a little harsh to drink continuously because it smells so bad.",2.0
37,,"I'm really sorry, but the smell was so strong that I couldn't finish a bottle. It was a failure for me because it doesn't make sense if I can't keep taking the effect. I'm drinking Chocola BB now. It is small and easy to swallow.",2.0
37,,"Frankly, I used it. I feel like a hive rash. I know why, but it sits with me for 5 minutes, and my ears turn red and I feel my face inflamed. I know why. I wish to improve the product (for information, I took Complex B from a second company, nothing happened to me)",1.0
37,,"Nicotinin is too high. Adults cannot exceed 35mg on average. This one only costs 100mg. It is recommended to take two tablets at a time. Often cause skin flushing, rashes, gastrointestinal discomfort, nausea, elevated blood sugar, tingling sensation in hands and feet, hyperuricemia, some people are slightly allergic to nicotinia (a kind of nicotinic acid), eat Afterwards, the whole body will be flushed and itchy. ‧Nicotine acid has the effect of dilating blood vessels and can be used to lower blood pressure, but long-term high-dose intake can induce diabetes ‧If ingested in large amounts, it will cause liver damage",2.0
37,didn't fit,"I chose this one, which has a high rating because I thought it would improve my fatigue, but after drinking this after eating, I have stomach discomfort, nausea, and diarrhea. Even if I try it another day, I get the same symptoms, so I don't think it's right. The ingredients of B12 and folic acid are also good, but I'm sorry.",1.0
37,My body burns and I lack sleep,"B vitamins are certainly a necessary nutrient, but they should be stopped because it doesn't make sense for the body to burn and affect sleep. The format of folic acid and B12 is good, but there are many people who have allergic reactions, so maybe there is something? ??",1.0
37,Skin is,"After I started drinking 2 tablets in total in this morning and evening, my skin became red and dry like atopy. The skin has peeled off like a powder blow. Although my lips also had not been rough up until now, I have dried and become frustrated. I have started to heal gradually after I discontinue it, but I still dry. It started about 3 days after I took it, so it will be effective immediately for those who do not fit. Please carefully choose supplements of vitamin B group when choosing.",1.0
37,,"I tried it three times, may God bless you. It changes the color of urine to phosphorous yellow. See this video on YouTube about changing the color of urine and the reasons. One of them talked about the vitamin B complex that changes the color to phosphorous.",1.0
37,Feeling desperate after buying,"I bought health products in iherb by complaining ""complaint"" Despair cause: Several products bought here have the following problems: Pills appear unclear spots, including mildew, tide and other factors. Afterwards, the manufacturer and iherb both suggested that I am very surprised to eat! I never thought that such a big platform would be a good word, and it would make customers healthy and safe. No doctor will advise customers to eat, no matter the shape, color, odor has changed its pills or construction products, will tell you what you can eat, must not take your health to heart, this is here for me It happened several times, hope you will not be the next me. You asked the customer service and said that he asked you to send an email, and he ignored the email. Things are not gone, the reply is one day fast, two or three days slow, and I wo n’t reply again. The online customer in China is also the grandfather. The customer is still saying that he is offline by himself, and each paragraph is copy and Paste, the robot is better than the online customer service. If you ask him to complain, he said thank you for giving them the data, and they will collect it. But it will not follow up.",1.0
37,Not satisfied,"I doubt the quality of this vitamin B manufacturer; my husband and I did not have a reaction to the ingredients in pharmaceutical preparations of these vitamins, but here we have redness and itching all over the body IMMEDIATELY after use. It was not from the first day that we realized what these consequences were. but since we are also suffering from a viral infection, this reaction aggravates the condition, as the ears began to burn, the neck and thin areas of the skin became covered in spots. Thank you for the answers and questions on uHerb, we found the answer there. I had to immediately drink the sorbent. Probably, this drug released too much energy in the body 😄😖 The nervous system triggered scabies",1.0
