page,review_title,review_text,rating
1,Life Extension Complete B complex,"only took product for 4 days, the stearic acid on the pills, caused an allergic reaction and had to stop taking it. Not likely to order again as they do not agree with my stomach",2.0
1,Bioactive Complete B-complex,First time taking this capsule. I've been urinating bright yellow colored urine. Never have this kind of side effects this is but it's not looking good. DO NOT BUY THIS PRODUCT. IHERB DENIED ME OF MY REFUND.,1.0
1,,"This is the first time trying out a Complete B-complex supplement, but this really tastes weird. Not sure if that is supposed to be for any brand on Complete B-Complex....Didn't manage to complete the bottle and no, will not attempt for second purchase again.",1.0
1,Too much Pyridoxine and B5!,"This has too much pyridoxine. I had a blood test and found my levels of B5 and B6 were significantly above the normal range. I initially thought it might contain active pyridoxal, but it seems the pyridoxal content is very low. The manufacturer cleverly omits the ratio from ingredients list to mislead customers. Studies have shown that excessive pyridoxine can block the absorption of active pyridoxal, leading to nerve damage. I didn't got any niacin flush. My urine was yellow but that effect of riboflavin and expected. It also has some kinda milky smell. Overall good supplement but I only gave 2 starts due to toxic ammount of pyridoxine and not mentioning the ratio of pyridoxine and pyridoxal",2.0
1,Have acne-prone skin? BEWARE!,"These might be good for someone without acne prone skin, BUT if you are not one of the lucky ones -watch out! After just a few days of intake it broke me out all over the face. This is the only new thing in my overall routine, so I'm curtain it's the B complex, unfortunately 😔",2.0
1,useless,I am taking these vitamins since there's no benefit or better change nothing,1.0
1,B complex sine caps are SMALLER than others!,It is ok and complete they contain methyl cobalamine not cyanocobalamine which is hard to find elsewhere. For somereason some pills are SMALLER than others? So what’s the dose in those?,2.0
1,Way too strong,I didn't realise when purchasing but this B complex has way too high levels of certain B vitamins and is not good quality for regular use. It contains the cheaper synthetic form ingredient of B6. I do not recommend this B complex and suggest finding one with the correct forms of B vitamins especially methyl folate rather than foolic acid that is not dangerously high. Taking this regularly can have a negative effect on the nervous system.,1.0
1,Dosage is huge,"The dosage in this B-complex is way too high! It makes me feel mentally altered for several hours, almost like I'm slightly drugged. If ChatGPT is right, this might be due to brands competing to stand out on the shelf by appearing more ""potent."" I don't think it's necessary — I’d rather choose a cheaper and more balanced supplement.",1.0
1,Dosage of B6,The dosage of these tablets is FAR too high. You would end up with severe neuropathy due to the 100mg of B6 in this tablet. There was a report on the ABC interviewing a Dr of a hospital who was seeing severe side effects from people taking 50mg or higher. I will be asking to return it. Otherwise everything else is fine and I was looking for the supplement with folate which this does as folic acid is synthetic and not healthy.,2.0
1,Awesome,I bought these for my hair & nails but they give me so bad knees pain and I never had these before. It's awful. I should've also read the 1 star...2 star reviews before buying it :(,1.0
1,No results,"I have taking vitamin B complex before and could feel the improvement, not with this one . Overall brand is seems cheaply made , together I purchased other products from this brand and was disappointed with it",1.0
1,good,This is a great all-around supplement. Good quality. Size and package is perfect for 2 moth plan. Covers all the essential B vitamins in forms. Effect: I feel more energy and focused since taking it. Highly recommend. Be careful because it might cause pimple break outs for sensitive skins.,1.0
1,I have thrown it away,The dosage of all the vitamin Bs in this product is too high. I worried about liver health so I stopped taking,2.0
1,Very strong synthetic B formula,"Bought this based on reviews but found it to be too strong for me and partner...We are both fatigued and burned out and thought this would give us energy....He had a terrible reaction - shakes and heart pumping/palpitations and felt weak...I ended up with shakes, palpitations and vertigo from taking this....this was the only thing we did differently and it was same day we took our first dose of 1 capsule only.....I would say this is probably ok for people who are already in a general good health condition....they are not fatigued or deficient in any way....this formula is super strong...will definitely give you energy but could for some people cause reactions like we had....so be cautious with high strength Bs....if you are an athlete or energetic person with good energy levels, can sleep soundly, not overly cold or hot person, is good tempered etc then OK but if you are trying to boost your energy because of chronic fatigue, menopause etc I would use a more gentler natural form of Bs like Paradise Herbs B formula....or better still go see a natural medicine doctor, Chinese doctor and get proper assistance.",2.0
1,Head Tension and Tingling Sensation (my personal side effects),"The first thing I noticed was my bright yellow urine, which is pretty normal when taking B vitamins especially excess riboflavin. I was regularly consuming this once a day (suggested serving: 2 capsules). After a few days of supplementing I noticed a tingling sensation in my right temple. Which I didn’t pay too much attention and didn’t even bother to think why it occurred and though it will just subside, that being said I still continued to consume it daily. However, the tingling sensation persisted in addition of weird tension still in my right temple. I was flabbergasted, ironically the tingling sensation and tension would gradually start an hour or two after taking this certain supplement. So I suspected, this could be the culprit. Just three days ago, I stopped consuming this supplement, and since then to this day the tingling and tension didn’t come back. So, I guess my hypothesis was right. This my first time using this brand for my B vitamins supplement. I’m also currently taking Vitamin D3, K2 MK7, Zinc,Fish Oil and Magnesium on a daily basis yet I didn’t get any weird side effects aa mentioned above. Am I the only one having this? Lmk.",2.0
1,didnt like it,"It did have an unpleasant smells and taste but it can be tolerant for some. the size of the capsule was too big, it was difficult to swallow. i did notice a change in my urine color. did feel a bit of energy but it didnt last.",2.0
1,I didn’t like the product.,"I don’t feel any difference from taking the supplement. It makes my urine fluorescent in color. In my opinion, it’s not a good supplement.",1.0
1,RDI levels too high,"Easy way to take b complex vitamins without the fuss, clean and fresh packaging with no smell to the tablets. I personally won’t reorder looking into the dangers of excess b6 and b12 specifically",2.0
1,Fair,"It’s an average product. The quality is decent, but I didn’t notice any significant results. Packaging and shipping were fine, but overall it didn’t meet my expectations. Might work better for others.",2.0
2,Nausea,This brand doesn’t make high quality products. You can tell by how sick you feel after taking them. I put up with it for a while until it became unbearable and I just stopped taking it altogether.,2.0
2,Not for me,Perhaps I lack the Intrinsic Factor to absorb the B vitamins. It may work well for others but all I got was very yellow urine.,2.0
2,B-6 toxicity,It has pyridoxine chloride in the content and caused me to have B-6 toxicity after several days. I take B-6 every day in the form of only p-5-p and don't have this problem.,2.0
2,Niacin flush,"Wish I knew about the Niacin flush before purchase, can’t use this product anymore so completely wasted money unfortunately. Love this brand of supplements but feel like there should be far clearer warnings.",1.0
2,BE AWARE!,"I thought this was a good company, was getting many supplements from them. I will not buy anything ever again. They have a dose of 100mg B6. Read the following and you'll be the judge: B6 neuropathy, or peripheral neuropathy, is nerve damage in the hands and feet (tingling, numbness, pain) caused by excessive intake of vitamin B6 (pyridoxine) supplements, even at doses below 100mg/day, though high doses are more common culprits, and it's often found in multivitamins. Symptoms can worsen with continued use, potentially leading to balance issues and difficulty walking, so checking supplement labels and consulting a doctor is crucial before taking high-dose B6.",1.0
2,Handle with care - Affected me badly,"I purchased this B Complex product, took it for 3 months. I ended up with numb hands at night, and sometimes while sitting and watching movies or tv. I read about many people in Australia having health problems and poisoning themselves after taking high levels of Vitamin B6. Google search: ""Vitamin B6 toxicity is caused by taking excessive amounts of B6-containing supplements. This can cause peripheral neuropathy. The symptoms of peripheral neuropathy include numbness, tingling, pain, and weakness in the hands and feet."" When I checked the % daily value of B6 in this product, it is 5,882% of RDA! It also has high levels of B12 12,500%; B5 10,000%;1 8,333%; B2 5,769%; B7 3,333%. I have stopped taking these capsules, and I don't have numb fingers anymore. Handle with Care! Be extremely careful!",1.0
2,Is it me? Affected my sleep!,"Bought two of these along other products with a view to assisting my energy levels etc. However, having attempted around three seperate instances and each time my sleep suffered and not just one night over the next several days of course with one off intake no benefit with energy levels!",1.0
2,Allergic,"Unfortunately I was allergic to this product so I can't speak the the effectiveness. The pills are a standard size and easy to swallow. Was disappointed as I really wanted to give it a try because I have heard great things about this brand. Ingredients list looks good as does the quality - just not for me sadly,",1.0
2,Excessive B6 levels,I've been taking these for 6 months now and have developed pain in my hands and feet. Just by chance I came across news articles online linking excessive B6 levels to peripheral neuropathy. I bought this product based on the reputation of the brand but it contains 5000+% the recommended level of B6 which is banned in some countries and is linked to peripheral neuropathy. Anyone taking this supplement needs to be aware of this. The condition is not always reversible. Can't understand why this company is not subject to lawsuits.,1.0
2,Too high dosage of B6,I started feeling ill and went to the Dr to have blood tests. I have only been taking these tablets for a few weeks and have been told the B6 dosage in these tablets is double what is recommended per day. I have had to stop taking them as my blood showed dangerously high levels of B6.,1.0
2,,"Subject: Concern Regarding Product Quality and Refund Request To whom it may concern, I have been a loyal iHerb customer, purchasing most of my supplements through your platform. However, I have recently noticed a significant decline in the quality of some of the brands I frequently order, including but not limited to LIFE EXTENSION and NOW. For instance, I observed that the Vitamin B Complex capsules appear lighter in color compared to previous purchases. In the past, I experienced noticeable benefits after taking this supplement, but now the effects seem minimal and, surprisingly, I feel tired after using it—quite the opposite of what I would expect. To validate my concerns, I tested a different brand of B vitamins and found their effectiveness to be far better. Based on this comparison, I have decided not to purchase LIFE EXTENSION and NOW products again. As such, I would like to request a refund for my recent purchase. If necessary, I am willing to return the items you sent me. Furthermore, I have been considering submitting these products for laboratory testing to verify their contents and determine if they match the manufacturers' claims. I strongly believe that iHerb should establish its own testing laboratory and conduct regular, random quality checks on products to ensure manufacturers meet high standards. For now, I kindly request that you process a refund to my credit card. I have not yet decided whether I will continue using iHerb, as I am unsure whether I can trust the product quality moving forward. If needed, I can provide photos of the Vitamin B Complex capsules, highlighting the color difference between older and newer batches. Additionally, I noticed that my urine's color is no longer as yellowish as it used to be when using these supplements. Thank you for your understanding and prompt attention to this matter. I hope you will take my feedback seriously and implement measures to maintain quality and customer trust. Sincerely, Very dissatisfied buyer",1.0
2,Complete B-Complex,"a good combination of vitamin Bs and good price. Good products of good quality. Less fatigue n feels better after taking everyday complete B complex, additionally Mega Benfotiamine, R-Lipoic acid and vitamin B6. Good quality and must be with good ingredients. Size is easy to swallow. Like the products very much and found them helpful. Have been seeing many specialists for numbness but not effective until taking Life Extension products . They are helpful n at affordable prices.",1.0
2,,I did not see any results yet even though i’m using it,1.0
2,I cannot take this long term,"Too much vitamin B6 I have been told that if I take this, I cannot take this long term, so I need a B complex that is about 100 to 200% of the total daily recommendations.",1.0
2,Warning: 100mg dose B6 can lead to toxicity and peripheral neuropathy,"Long-term B6 supplement with more than 10mg can cause irreversible peripheral neuropathy and must have warnings. In Australia, max recommended daily dose is 50mg from combined sources. Consult a pharmacist or doctor before using this Life Extension Bioactive Complete B-Complex with 100mg of B6.",1.0
2,There should be a warning for eczema prone people,"I do not have eczema for 2 years plus, but I started taking this in a week, my skin was red, hot and eczema flare out. It may be good for some people, but folks with eczema history, donot take this.",1.0
2,Dangerous Product,"B vitamins are generally safe because they are water soluble and your body excretes what it doesn’t need through urine. Toxicity is rare but possible with high doses. Some people experience nausea or vomiting, headaches, insomnia, skin rashes, flushing, fatigue or weakness. Long term excessive amounts can cause liver & nerve damage, irregular heartbeats or heart palpitations, high blood pressure, or serious allergic reactions. I started getting headaches, then was nauseous all the time. I was already taking this supplement with food. I tried taking one pill with or just after breakfast and the other pill with or just after dinner—I was still nauseous all the time. I finally thought to look at how much of each B vitamin was in this supplement compared to the recommended daily dose. Every B vitamin in this supplement is very excessive compared to the recommended daily dose. More is not always better—definitely not when it comes to your health!",1.0
2,Silica shouldn't be in supplements,"Thought I had gotten a great Methylated B Vitamin complex. Overdosed B vitamins. Contains silica, aka sand. While this may not bother many ppl, I suffer from scleroderma. Silica is as bad for my autoimmune issues as smoking cigarettes. Caused serious circulation issues, dead blood vessels I'll never get back. Ultimately, the silica is just a filler. So not only is it harmful, it literally does nothing to improve the product. I took this for almost a month before realizing this is what was hurting me so much. I don't ask much from supplements, except they shouldn't make one less well than before the started taking it. I wouldn't recommend any supplements from this brand as many contain ridiculous fillers, dosages, as well as supplements that shouldn't be taken together. Terrible quality. Harmful ingredients. Ridiculous dosage. Huge sized half empty bottles.",1.0
2,heard alot about it and i wanted it but the bottle i received is not alright,one of the best quality b complex but it has too much b6 i think,1.0
3,Good,"Life Extension, BioActive Complete B- Complex good 👍🏻 ingredients and size ... no taste Vegetarian",2.0
3,Not Suitable for Me – Experienced Nausea,"I began taking this B-complex supplement with high hopes due to its comprehensive formulation. However, after about a week of consistent use, I started experiencing persistent nausea. Despite taking the capsules with food, the discomfort did not subside, leading me to discontinue use. Additionally, I found the price point to be a bit high for the quantity provided. While this product may work well for others, it unfortunately wasn't a good fit for me.",2.0
3,Excessive Vitimine B6 in This Formula!,"We have taken Life Extension Complete B-Complex for years and I believe it helped me have sustained energy. However, as I have gotten older, I began having uncomfortable tingling in my feet. Research online indicated that excessive Vitamin B6 might be contributing to this so I discontinued this product for about a month and the tingling has gone away. Most B-Complex supplements contain very high doses of each B perhaps because B supplements are water soluble and the belief has been that the body flushes itself of any excess not needed. However, for me, and evidently many others, the excessive B6 (5,882% of Daily Requirement) is excessive and caused problems.",2.0
3,Worst B-complex I have ever taken,"I’ve used B-Complex vitamins from various trusted brands, and I usually notice a real difference, more energy, better metabolism, and relief from headaches and shoulder tension. With this one, unfortunately, there was no noticeable effect. The ingredients don’t seem to have the right potency, and the quality just feels lacking. The capsule size is big, didn't care much about taste. packaging is good, just like any other Life extension supplement.",1.0
3,,"I bought a few bottles of this B Complex capsules , however, there is something in this products ( in the past I used their Multi vitamins- “two a day” ) I have experienced my hair was shading and falling out. I’m stuck with a few bottles as I stoped taking them all together .",2.0
3,Taste like perfume,"The size of these pills are really large so I had to break them apart to take them. They taste like a floral citrus perfume, lingers long after you have taken them. no change in energy levels, did not help with with regulating my metabolism. the ingredients were not of a great quality in my opinion, just didn't seemed potent enough. This supplemement had no real effect for me. I will not buy again.",2.0
3,Not for me,"I noticed nothing out of the ordinary to be honest. Actually, the only thing I noticed was that I became constipated. It says on the bottle that you may have ‘gastric disturbances’. I have taken the recommended 2 capsules with food daily and have finished the bottle . I brought it to have more energy. It did not give me any more energy. It didn’t work for me. 1 star only because I couldn’t give it nothing.",1.0
3,I had terrible side effects,I felt very itchy while using it but it took me time to realise it was because of the pills. Also my urine had a very concentrated smell and colour. Besides I felt dehydrated while using it. Didn't feel much difference in my overall state so don't know if all the uncomfortable feeling worth it.,1.0
3,B complex,"I will be very honest at the beginning i have heard that this product quality and taste is good. But to be very honest i didnt like to use it at all, since its very heavy and hard to swallow it. Second it makes everything yellow when you go to the toilet. As a vitamin its good for neevous system and metabolism but try to find another brand better than this one please.",2.0
3,,"I need B12 and other B vitamins but this brand caused my heart rate really high for some reason, I couldn't breathe and it made me light headed and dizzy, I got so scared. but maybe it's just me, my mom took it too but nothing bad happened to her. will try another brand.",2.0
3,Unwanted additives,"If alternative health professionals can formulate healthy, wholesome, and highly effective products for the wellbeing of humans and pets, why do so many manufacturers add unhealthy & unwanted substances to their alleged ""health"" products? This absolutely infuriates me. One example is binders or coatings for tablets and capsules. One company that I know of produces 100% organic health supplement tablets and caplets without any binders or coatings; they just compress them to stay together (bind). Another example is capsules. Some companies don't add any fillers to the powdered herbs & extracts, and only have 1 ingredient in the capsules. Bravo to them! Sadly, most companies have fillers blended in with their herbs & extracts, and several unnecessary ingredients in the capsules.",2.0
3,Not for Me...,"This product seems to have great results for a lot of people, but I don't think it's for me. After taking this, urine is an unnatural, almost neon yellow. I may be wrong, but I take this as a sign that most of the product is not being absorbs and being literally wasted.",2.0
3,Unsure about the dose/absorption,"A little TMI but after taking this, I had extremely neon urine, which I guess is your body excreting any excess. I was taking half the dose every other day because I had heard about vitamin b being toxic in high doses but still saw this. Not sure if the dose is just extremely high or the absorption isn't great.",2.0
3,,"As per recommended dosage, I take 2 capsule at morning, but after about 20 minutes, I feel itchy especially on neck, arms and face. Feels like I am on fire! Then I reduce consumption to 1 per day, but condition still persists. So scary, end up throw it away....",1.0
3,"caused pain and difficulty in urinating after a week, DO NOT RECOMMEND!!!","got my entire family suddenly suffering from difficulty urinating (painful, frequent) and worse, my father needed a catheter for more than a week since he could no longer pee, HORRIFYING EXPERIENCE!!!!!!",1.0
3,B6 TOXICITY !!! BE WARNED,"My dr reviewed my bloods to find my B6 level at a toxic level. I showed her this formulation that I was taking, and she said that Vit B6 isn't water soluble and excess amounts would be stored in fat, therefore, the daily dose is waaaaaay excessive particularly as it doesn't leave the body quickly. Basically, it had built up in my system faster than I could excrete it. Probably ok to take one a week but def not daily as directed.",1.0
3,Not ok for me,"I didn’t pay attention when purchasing this complex, but it contains synthetic B6 (Pyridoxine HCL) along with the better form, Pyridoxal 5' Phosphate. I’m not sure why they included it, but I certainly won’t purchase it again, as we are already extensively exposed to synthetic B6 in processed foods, and long-term exposure can be harmful to our health.",2.0
3,BEWARE! Too high B6. CAUSED INSOMNIA,I had to stop taking it. Insomnia for months. The B6 content is VERY high. Now taking another brand and my sleep is back to normal.,2.0
3,bad reactions,when I take the even less than half of tablet straight away I was very red and feeling bad I go emergency please be careful,1.0
3,May cause heartburn,"This product caused me to have heartburn, especially at night. Not sure why as I took it early in the day after breakfast. I threw it in the trash. Now I notice many reviews mentioning heartburn as a side effect, so it is not just me.",1.0
4,,I can't consume at all after once i took & vomited immediately. The smell of this supplement to me is super disgusting.. Feeling vomiting by smelled too.,1.0
4,Urine colour change to yellow,After taking this capsule my urine colour changed to yellow this my first day so please can anyone tell me it’s normal side effects or I should stop taking,2.0
4,Don't work,Don't work well for me. Got acne after using. My body don't agree with it.,1.0
4,Below average,the smell of this supplement is extremely strong. not sure if it's the quality or ingredient that's causing this. have taken on and off for at least a month. found the package too big for the 60 tabs. a bit deceiving upon receiving. Life extension should make the packaging smaller to fit the be amount. packaging not very environmental I would say.,1.0
4,Awful feeling,"I was very excited to get this product and I heard very great reviews about it, but unfortunately my body didn’t feel the same way. :( I actually only took one capsule first and within an hour I felt extremely nervous and jittery inside. It wasn’t a pleasant feeling at all. It lasted the whole evening. The next morning I decided to try two capsules for some reason thinking, if I took the recommended dose that I may have different results , but boy was I wrong and stupid. Lol I had the same awful anxiety , but even worse! I never felt that way from taking b vitamins before. I have no idea why my body reacted that way, but unfortunately it did. I’ve had wonderful experiences with other of your products though!",1.0
