page,review_title,review_text,rating
14,smelly pills but effective,"I wish product (pills) didn't smell. I haven't found a vitamin B that didn't smell. Must take with meal, or I get Hot flashes & rashes. I know product is working, so following directions are critical. Value is good when product is on sale.",2.0
14,,"I prefer the Jarrow brand of B-Complex... This one smells the same as the cheap stuff you buy at the grocery store. Get the good stuff, go with Jarrow or Thorne b-complex.. LE is a good brand but this b-complex is no good IMO.",1.0
14,,"After taking 1 capsule in the morning, urine turned light yellow throughout the day which does not happen when taking other brand of supplements. I feel nauseating and light headed. Wonder if this is the side effect. Not recommended.",1.0
14,,Stomach felt gastric upon taking this supplement as per stated on the label. Tingling sensation due to lack of Vitamin B so I bought this to try but unfortunately it didn't help me much,2.0
14,be careful,me and my mom had severe body hive and reaction to this supplement. all my body is on fire and itchy. please ask your doctor first..note to self: negative reviews should be read too,1.0
14,,"This is my first bottle of B complex supplement, I often take it before meal, so my stomach is not feeling well, I should have taken it after meal.",2.0
14,,"I have had severe rash after taking this B complex. Rash first appears behind my ears, around the neck then goes down to the shoulder and arms and then body. I did not what caused it till a week later. Be very careful taking this one !",1.0
14,不滿意,"my lips crack if i am lack of vitamin B complex. and if the B complex pills is good, it will heal after 1 day. And my lips cracked all the way through out the period when i am taking this product which means, it is useless.",1.0
15,,second morning of taking this supplement and I have hives all over my body. this is a new product for me and it will be going in the garbage can,1.0
15,,These capsules give you a complete serve of all the Vit B’s. I take them for sleep as well as many other things. Also has Biotin which is good for your nails.,2.0
15,Disgusting product in every way,"The smell and taste is unbearable, it is worse than rotten fish carrots and even when the container is closed it reeks and makes the entire pantry smell. The size of the pills are big and hard to swallow on top of that. And even worse, you need to take 2 rather than 1 unlike other B-complex vitamins in which u can take 1 for the same amount of nutrition. Not sure how they managed to fall so far behind. The 100mg of B6 is way too much. Netherlands set max daily intake for B6 at 21mg for supplements, and NHS in UK recommends no more than 10mg daily. This is because neuropathy can be caused even with less than 50mg daily. Not worth taking 100mg B6 for extended periods, the risks of peripheral neuropathy are high and the amount of B6 needs to be lowered in this supplement. I have no idea why the rating for this product is high, I believe it is thousands of bots. Do not buy this garbage.",1.0
15,Not suitable for everyone,"After I took the tablet , my skin got red and so ichy",1.0
15,Burning red skin reaction!!!,I have burning red skin reaction all over my body and I’m not allergic to anything ever before!,1.0
15,too big,"just tried it for the first time, capsule is really big and I had difficulty swallowing.",2.0
15,Taste a little weird,Quality is good but after-taste is a little weird.,2.0
15,My stomach upset,"I tried several B-Complex supplements. I didn't see benefits, and my stomach got upset after taking the vitamine even with food.",2.0
15,Cheap,Cheap product with a cheap artificial ingredient. I wouldn’t buy again,2.0
15,NOT FOR ME,Had to stop taking this shortly after I started. It made me irritable and anxious. Maybe a poor combination for me.,2.0
15,Too strong,Please be aware of its heavy dose. I got stomach after I took. But it depends on ppl my family is fine,2.0
15,No,"After using 2 bottles of this I didn’t see any improvement with it,",2.0
15,Didn’t notice any difference,I didn’t really notice any difference vs taking b12 only. The tablet is also huge and smells funny..,2.0
15,,It didn't go well with me. I stopped taking it after the 2nd time.,1.0
15,,Taste is awfull. I had problems with my stomach after taking them and I had to stop.,2.0
15,Poor quality,When I took this product I didn’t feel well.,1.0
15,Take B separately,I've been told to not take B6 or B9 as both are neurotoxins.,2.0
15,,Contains Synthetic form of b6 which I just found out is not good for you. Wish they just kept it as p5p only,1.0
15,,Makes the color of my urination turn yellow. Otherwise no issues with the quality.,2.0
15,May be good but too smelly to keep trying,The ingredients sound good but my goodness does it ever smell bad… can’t get past it to finish the bottle..,2.0
16,good,Good product helped me a lot Good product helped me a lot,1.0
16,,When I took this product my urine was yellow-orange color.,2.0
16,Quality,I don’t feel good after I use it I so I stopped it right away,2.0
16,,"Unfortunately, I'm disappointed that these did not work at all for me..",1.0
16,B vitamins,Not sure about the absorption of these vitamins. Did not notice a change,2.0
16,Not a fan,Tastes weird. A bit stale? Not sure if that’s normal for vitamin B,2.0
16,Does not extend life,"Does not extend life, although is called Life Extension. Gives off weird energy",2.0
16,Lots of side effects,"15 minutes after taking even one capsule, you will feel severe headaches and the color of your urine will turn green like Absinthe!",1.0
16,bad,Unfortunately it is bad quality & won't use it anyway!,1.0
16,,"This product caused acid reflux , stop using due to side effects.",1.0
16,,I have tried better. I will be going back to Solaray as this one is not great for the stomach and no immediate effect.,2.0
16,Taste/ burp after,Bummed this doesnt work for me. I use this brand for other supplements. Thought I'd try the B complex. I burp this vitamin.,2.0
16,,"Normally this company produces the best products, most all are of the highest quality. Therefore, I purchased this product without hesitation, but failed to notice that it contains Niacin (Vit B3) - which is the Flushing type, rather than the desired Non-Flush form (Niacinamide , which a Must, really, if you take Vit B supplementation) as the Flushing (Burning) feeling that's caused by Vitamin B3 is Very unpleasant indeed.",2.0
16,,Have obnoxious smell. Capsules have black spots. Not so visible in picture. It really smells bad,2.0
16,Not satisfieD at all,Not satisfied NOT satisfied NOT SATISFIED!! I don't like the colour of the bottle,1.0
16,,The capsule smells terrible. Smell like rotten eggs. I will not buy this brand again.,2.0
16,,very strong smelly!,1.0
16,,I get a horrible reaction to taking these. I cannot take them at all.,1.0
16,,"awful taste , i have notice the results but I cant keep eating it due to the disgusting taste",1.0
16,Excellent!,"Too much niacin vitamin, face, neck got red and burn ((",1.0
17,Upset my stomach,After using this for a while I noticed that this upset my stomach quite a bit…,1.0
17,It’s toxic,Gets me temperature and stomach problems. Very tough. Other two people I got it for also got the same from it.,1.0
17,,A bit pricy compare to others which has same content. But if price is not an issue then this is worth a try.,2.0
17,,Smell and taste way too much. I'm not able to take them anymore.,2.0
17,,smell too strong. i have skin reaction right after taking it.,1.0
17,,Didn't really see any difference after taking it for 2 weeks.,2.0
17,Bien,"Allergic reaction, rash on my face and body, horrible burning sensation",1.0
17,,Too much B6. Caused a reaction that lasted weeks even though I stopped taking the vitamins.,1.0
17,,just pee yellow nothing absorbs made stinging in the urination for 2 days,1.0
17,,turns my pee neon green and dark yellow. feeling restless and sleepy after taking. highly not recommended,1.0
17,Broke out in hives,My arms were covered in solid red welps. That has never happened to me before when taking supplements/vitamins.,1.0
17,Nooooo,Very negative side effects on bladder and stomach since day one!!! What is this so messed up,2.0
17,Different effect,I find this is different from the one prescribed by my ENT dr. It has a burning effect while the dr prescribed is soothing.,1.0
17,Allergy,"I have no allergies, but from 1 capsule of this my elbows and knees are red, second time when taking it",2.0
17,it's overdosed,b6 is toxic at 50mg in a daily basis . and this one has 100 mg of b6 b6 toxicity is really bad,1.0
17,Not usable,B-Complex has allergenic impact and I cant to use it.,2.0
17,stomach discomfort,It seemed good but it caused me stomach discomfort and belching so I stopped it.,2.0
17,Not for me,Unfortunately this product did not work well for me it wasnt a good fit for my needs while others may have a different experience,2.0
17,waste of money for me,"Personally, I didn't notice any difference after taking all the capsules, so I didn't order it again.",1.0
17,extremely high dosages,have to be careful if the dosages are extremely high. I open up the capsules and pour it into water luckily it tastes okay,2.0
18,,"The first time I took these, got a horrible rash, and digestive problem. I fully recovered the next day, they mention these side effects on the bottle but I will definitely not be taking anymore. The side efffect is not worth it.",1.0
18,No Good Product,I experienced Bright Yellow Urine. The B complex was Not Absorbed into my blood stream. I woud Not buy again or recommend to iheb Customers.,1.0
18,,Great quality package is good size is enough there is no taste,1.0
18,Had to stop taking it,"Had to stop taking it, made me tingling sensations at night, which interrupted my sleep",2.0
18,,Irritating to stomach and the capsules are too big. I’m not satisfied. Will try a different brand.,2.0
18,,"This was awful, it makes your pee bright neon green and it has an awful smell to it as well",2.0
18,,Made me very very lazy and fatigues. May just be me not needing it as I thought I did,1.0
18,,Didn't do anything for my B12 levels. I ended up being deficient even after taking these.,1.0
18,أقل من المتوسط,product as described good quality perfect ingredient bad taste small size it gives me alot of benefit,2.0
18,Pas satisfait(e),"Finished all the pills , but have not notice any changes or improvement as advised .",1.0
18,,"nice product , i Tried it more than once good product",2.0
18,,smell bads i dont know why i could not use it,1.0
18,,"So smelly, and huge capsules I’ll not buy it again",1.0
18,,"It smells horrible. Also, my urine color changed in a scary way after i use. So i decided to stop using it. NOT recommended",1.0
18,,I reacted badly to this complex. Made me so dizzy and gave me skin rash.,2.0
18,,I love it and its a unique composition but effet the size of the pill is so large,2.0
18,,Not a fan really did not like the niacin flushes,2.0
18,,smells very bad + create problems in my stomach + I feel dizzy and out of balance and almost throw up after I take it,1.0
18,,I think the dosage strength is too strong that makes me feel weird and numb for a while.,1.0
18,,Th is product didn't do well for me. The nausea after taking it was unpleasant.,2.0
19,Not good,Smells weird and urine turns bright yellow when I take it I was wondering if this will harm my kidneys so I stop it,1.0
19,It caused rashes,"I get rashes every time I take it, not sure why. anyone got the same?",2.0
19,,"I'm not sure what was wrong with these capsules, but the smell was so rancid, I was too afraid to keep taking them.",1.0
19,,Not for me every time I use it makes me go to the toilet very quick,2.0
19,Excellent!,Incredibly high dosage of B vitamins honestly I was scared to take it.,1.0
19,,this supplement smells so bad i couldnt take it unfortunately due to the hoorendous smell ..,2.0
19,低於平均值,Maybe the effect is too strong. Suggested to take 1 pill only per day,2.0
19,,This has the form of niacin in it that causes flush . Beware.,2.0
19,,"Orange power goes everywhere, only B Complex I have taken that have me face flushing. Binned them as tasted vile and so messy",2.0
19,,"I have always supported the brand, but this product has no feeling!",1.0
19,,Feel so sick and nausea after that don’t recommend,1.0
19,Bad smell and stinky,Stinky smell and makes bad breath smell.,1.0
19,Be very careful!,I had anaphylactic shock from this product. Also Tachycardia.,1.0
19,,I broke out into rashes after taking this supplement,1.0
19,Pas satisfait(e),"I did not start yet, will come back after 6 weeks of utilization.",1.0
19,Pas Mal,Ok,2.0
19,Hot flush!,This vitamin complex gave me a hot itchy flush on my neck and face after 3 days of taking it :-(,1.0
19,I don't take any product. please give my money.,I don't take any product. please give my money.,1.0
19,,"Red face allergic reaction. Red knees, red arms. Beware",1.0
19,,Flushing and itchy after taking it….,1.0
20,AWFUL SMELL !!!,VERY BAD TASTE AND AWFUL SMELL !!!,1.0
20,High dose. Allergic reaction/ hives,High dose. Allergic reaction/ hives,1.0
20,,Takes very long to feel the effect.,2.0
20,,I had a reaction to this cant take it,1.0
20,,It has niacin that causes a rash for me.,2.0
20,,"To much stomach problems ,not good",2.0
20,Not satisfied！,allergy to it. Whole body burning red .,1.0
20,,Didn’t suit me and made me nauseous,2.0
20,Huge capsule and oxidize halfway,Huge capsule and start oxidizing halfway through the bottle.,2.0
20,不滿意,all the things mentioned in the caution list happened.,1.0
20,Be Aware of Extremely High Levels of Vitamin B,"Be aware that this product has extremely high levels of Vitamin B that are up to 12,500% of the daily recommended dose. Also be very careful if taking other products/food/supplements with hidden B vitamins in them as B3 (Niacin) and B6 (Pyridoxide) in particular can cause real harm in large doses. I split the capsule powder into half strength doses and it was still too strong. I take it at quarter strength and that is enough. Be aware before purchasing! Look at the potency panel.",1.0
20,Elergic reaction,Not for me,1.0
20,too high level,"the b6 was too high a dose, i took the recommended dose for some months and had complications, my dr did testing and my b6 level was extremely high, off the charts, i had to immediately stop taking it per dr orders and that was a year ago and its made my apprehensive to take another b complex since then",1.0
20,not for me,It gave me headache,2.0
20,,feel hot in ears,1.0
20,,good product,2.0
20,滿意,Good~,1.0
20,,No good product,2.0
20,,Good for dibtic pt,1.0
20,Awesome,Great product,2.0
21,Synthetic B vitamin,It is not healthy to consume synthetic vitamin B. Natural is the best way to go. I was taking this product for months but did not do anything for me. I found out later that it is not good to consume synthetic B vitamins. So you own research,1.0
21,Dangerous company,"Dangerous company. I took it in and at the beginning i had only some stomach pains. after some days i had puke and many stomach pains. I tried many many different vitamins in my life and i have not seen so dangerous company, I do not recommend.",1.0
21,,Awful,1.0
21,👎🏼👎🏼,Bad taste and smell,1.0
21,Oil consumption and taste,Oil consumption and taste,1.0
21,Too big,"After I had it, I did not feel well. I felt like puking. It might have been because of the ingredient, which is in the form of vegetarian capsule. Also, the size was quite big for me. Never repurchasing it.",1.0
21,Oh the smell and taste !,"I HATE this product. I bought it and feel like I need to use it because I need to take B vitamins and I paid for it. I've never had such horrible tasting and smelling vitamins of any kind. I don't know how good the quality of this product is but I have gagged , coughed and choked due to the taste so it matters little to me about how good this vitamin supplement is. I wonder at all the positive reviews. Is no one else affected by this? Could it be that something is wrong with the ones I got?",1.0
21,,"Peace be upon you all. I'm an iHerb intermediary from Palestine. I hope you'll support me by commenting. I don't personally try all the products, but they are genuine and guaranteed. Before purchasing, you can read other people's reviews and benefit from their experiences by checking the ""My Reviews"" section. Selecting ""Details"" or ""How to Use"" will help you learn more about the product's ingredients. Please don't forget to like! Thank you.",2.0
21,Vitamin B complex,"I took it because my hands were getting tired and it was very helpful and relaxed my hands but!!!! It caused white pimples to appear on my face and in strange places and the pimple with the white head is painful, that's what made me stop taking it before the two months were up. Even my urine, by God, becomes more yellow because of the ingredient in the pimple. It's not a bad thing, but because of the ingredient and its color, I won't buy it again.",2.0
21,horse doses,"I don't usually take vitamins, but I decided I needed to. I took them for almost a month and then overdosed. I think it was B3 or B6. My whole face suddenly turned red. I even called an ambulance for the first time. The next day I took them again and started blushing – immediately taking loratidine. On the third day, I repeated them and it's clear that they're after me. I don't take them anymore and I'm generally wary of this brand.",2.0
21,,"Even after eating, the smell still lingers, so I stopped drinking it. If I drink it on an empty stomach, it makes me feel nauseous. It's a shame that the ingredients are good, but it doesn't agree with my body.",1.0
21,Like an overseas product,"For Japanese people, the capsules are large and difficult to swallow, so continuing to take them can be a pain. I ran out of the one prescribed by the hospital, and after looking around for a solution based on the amount of nutrients I needed, I couldn't find anything that met my needs, so I tried this one, which was the closest. Since the changes aren't immediately noticeable, I can't really say anything about the changes to my body...",2.0
21,I wanted to feel better...!,"I have a weak constitution and couldn't live without energy drinks, so I thought that wasn't good and bought supplements. I drank one bottle, but I didn't feel any particular effect... Energy drinks are definitely more effective for immediate results.",2.0
21,Was the effect too strong?,"I've been using Now Foods' B-Gun for about three years, and wanted to try the active form, so I started using it on November 26th (one tablet per day). Around December 6th (10 days later), I started getting eczema on my neck and angular cheilitis. I thought it was just my period, but it got worse and worse and turned into atopic dermatitis. I hadn't had any problems with Now Foods up until then, so I shouldn't have switched now. I'll go back to Now Foods. It depends on what works for you and what doesn't.",2.0
21,Easily deteriorates due to moisture and discoloration,"I feel the effect after only taking one pill. No flushing. The packaging is not good and easy to get wet. The packaging is okay. The quality is average. It is easy to get wet. The portion is full and effective. I noticed that after eating, the urine smells strong.",2.0
21,This one doesn't suit me.,"Many people recommend this vitamin B, but it is not suitable for me. Every time I take one in the morning, I will have a headache that day. Now I dare not take it.",2.0
21,Complete failure,"Full G…. (Native speakers of Slavic languages will understand) 😁 I have never had an allergy to B vitamins in my life. This is some kind of nonsense, considering that I have a folate cycle defect and need to take them as a supplement constantly. Allergic to these. Like many people, you should have read the reviews before buying, of course. But this is also a Slavic mentality: read the instructions only after it has already broken)))",1.0
21,"Quantity, ingredients and quality","Boosts energy Folic acid contains a positive and effective effect Improving the nervous system Improving metabolism Niacin flow What about the taste? Contains active B vitamins Dietary supplement Promotes energy production Promotes healthy metabolism Promotes a healthier brain, cells, and organs More active Your body is able to use each nutrient more effectively I liked it",1.0
21,normal,"It's normal, it hasn't changed at all, and I don't think it deserves praise in better companies.",2.0
21,bad,I ordered it based on the reviews and took it the first time and I had symptoms of shortness of breath and chest pain and I expected the reason to be from the food. The second day I took it and the symptoms were more severe to the point I was going to call the ambulance and I expected it to be a heart attack God forbid and I stopped taking it completely and I don't know the reason from the ingredients! Not important 👇🏻 Folic acid Quality Quantity Energy Flow Niacin Package,1.0
22,,🚫 The following groups are prohibited from using it: Gout patients (niacin increases uric acid by 25%) Parkinson's disease patients (B6 interferes with the efficacy of levodopa) Patients undergoing chemotherapy (folic acid may reduce the efficacy of methotrexate) Natural solution: Daily consumption: Beef liver (30g provides full-day B12+B2) Nutritional yeast (2 tablespoons provides complete B family) Thiamine (B1) 100mg 100mg* 1 times Headache/hypotension Riboflavin (B2) 75mg 200mg 0.38 times Fluorescent urine (harmless) Niacin 100mg 35mg** 2.86 times Flushing/hepatotoxicity (>1g/day) Vitamin B6 100mg 100mg 1 times Neuropathy (>200mg/day) Pantothenic acid (B5) 500mg UL not established - Diarrhea (>1g/,2.0
22,,"Peace be upon you all, an iHerb broker from Palestine. I hope for your support in commenting. I have not tried all the products personally, but the products are original and guaranteed. Before purchasing, you can use my evaluations option to read people’s comments and benefit from their experiences. Choose the details or method of use. You will learn more about the components of the product. Do not skimp on me with a like. Thank you.",1.0
22,My neuropathy increased due to excess vitamin B6,"I have peripheral neuropathy so I must take vitamin B supplements for proper nerve function. The fact is that I took a little more than one bottle and felt a lot of pain and numbness in my feet and hands. I also experienced difficulty falling asleep. I started researching and found that excess vitamin B6 causes neuropathy or aggravates it when it is in the form of pyridoxine hydrochloride. In its P5P form it is harmless, what happens is that this supplement has high amounts of that vitamin in its 2 forms but it does not specify what amounts it has of each one. To conclude, this supplement did not work for me, but I still buy other supplements this brand that seems good to me despite everything.",1.0
22,,It helps strengthen the immune system and provides additional antioxidant support. It supports eye and heart health and metabolism.,2.0
22,"Quality, ingredients, quantity and packaging","Boosts energy Contains folic acid Positive effect and effectiveness Improve the nervous system Improve metabolism Niacin flush How about the taste? Contains Active B Vitamins Dietary Supplement Promotes Energy Production Promotes Healthy Metabolism Promotes Healthy Brain, Cells, and Organs More Active Your body is able to use each nutrient more effectively Like it",1.0
22,,"I took it for a few days, for example, the day after staying up late, or the day after having trouble sleeping, but there was no significant improvement.",1.0
22,,"The quantity is great, the quality is fantastic, the products are excellent and amazing. I highly recommend you try them. Thank you, iHerb, the best site, it's amazing and fantastic, I recommend it to everyone.",2.0
22,The dosage is too high.,This product contains high doses of B vitamins and is not suitable for daily health maintenance. Its strong effects can cause discomfort and put a strain on the nervous system and heart.,2.0
22,,"Peace be upon you all. I'm an iHerb intermediary from Palestine. I hope you'll support me by commenting. I haven't personally tried all the products, but they are genuine and guaranteed. Before purchasing, you can read other people's reviews and benefit from their experiences by checking the ""My Reviews"" section. Selecting ""Details"" or ""How to Use"" will help you learn more about the product's ingredients. Please don't forget to like and share the quality. Thank you.",2.0
22,,"Peace be upon you all. I'm an iHerb intermediary from Palestine. I hope you'll support me by commenting. I don't personally try all the products, but they are genuine and guaranteed. Before buying, you can read other people's reviews and benefit from their experiences by checking the ""My Reviews"" section. Selecting ""Details"" or ""How to Use"" will help you learn more about the product's ingredients. Don't hesitate to like and share your feedback. Thank you.",2.0
22,I think I have an allergy,"The product is well-presented and easy to swallow. The composition is complete (all the B vitamins are included). Negative points: Possible allergic reaction, so caution is advised if you are sensitive. The capsules have a fairly strong odor, typical of B vitamins, which may bother some people. Clean ingredients, reasonable size, compliant packaging, tolerable taste. The composition is complete (all the B vitamins are included). Good quality.",2.0
